{
  "schema_version": 1,
  "job_name": "01_crop_seed33333333",
  "output_root": "state/runs/01_crop_seed33333333",
  "input": {
    "video_id": "01",
    "path": "data/00_Input_8K_7680x4320/01_Input_8K.mp4"
  },
  "seed": 33333333,
  "frames": {
    "outpaint": "all",
    "upscale": "all"
  },
  "preprocess": {
    "source_fps": 16,
    "processing_fps": 24,
    "source_resolution": [
      7680,
      4320
    ],
    "output_resolution": [
      1920,
      1080
    ],
    "resize": "lanczos",
    "video_codec": "libx265",
    "pixel_format": "yuv420p10le",
    "crf": 18,
    "audio_tempo": 1.5,
    "video_filter": "scale=1920:1080:flags=lanczos:in_range=pc:out_range=pc,setsar=1,setpts=PTS*2/3,fps=24",
    "fps_mode": "passthrough",
    "preset": "fast",
    "decoder_threads": 8,
    "x265_params": "log-level=error:pools=8",
    "color_range": "pc",
    "colorspace": "bt709",
    "color_primaries": "bt709",
    "color_transfer": null,
    "video_tag": "hvc1",
    "video_track_timescale": 24576,
    "metadata_map": 0,
    "stream_mapping": [
      "0:v:0",
      "0:a:0"
    ],
    "audio_codec": "aac",
    "audio_bitrate": "192k",
    "input_audio_streams": 1,
    "ffmpeg_loglevel": "error",
    "overwrite_partial": false
  },
  "outpainting": {
    "runtime_config": "src/video_outpainting/main/configs/inference_4k.yaml",
    "checkpoint": "src/models/outpaint_checkpoint_007500",
    "steps": 30,
    "positive_prompt": "",
    "negative_prompt": "people, person, human, staff, audience, crowd, backstage, seats",
    "input_resolution": [
      1920,
      1080
    ],
    "output_resolution": [
      3840,
      2160
    ],
    "alpha_feather_px": 16,
    "processing_fps": 24,
    "stored_fps": 16,
    "memory_optimization": {
      "video_only_gpu_weights": true,
      "vae_decode_streaming": true,
      "ffn_token_chunking": false
    },
    "recurrence": {
      "rebase_temporal_position": true,
      "use_latent_carry": true,
      "generated_prefix_strength": 1.0,
      "lineart_global_prior": true,
      "lineart_bias_schedule": [
        {
          "start_step": 0,
          "end_step": 9,
          "strength": 0.5
        },
        {
          "start_step": 10,
          "end_step": 19,
          "strength": 0.3
        },
        {
          "start_step": 20,
          "end_step": 29,
          "strength": 0.1
        }
      ],
      "lineart_source": "chunk00_first_final_rgb_frame",
      "lineart_start_chunk": 1,
      "lineart_reference_resolution": [
        3840,
        2160
      ],
      "lineart_source_resize": "none",
      "lineart_global_map": [
        30,
        17
      ],
      "lineart_density_method": "direct_4k_global_footprint_density",
      "lineart_density_padding": {
        "top": 8,
        "bottom": 8,
        "left": 0,
        "right": 0,
        "value": 0
      },
      "lineart_density_normalizer": 0.05,
      "lineart_extraction": {
        "grayscale": "RGB2GRAY",
        "gaussian_kernel": [
          3,
          3
        ],
        "gaussian_sigma": 0.8,
        "border": "BORDER_REFLECT_101",
        "canny_low": 35,
        "canny_high": 100,
        "aperture": 3,
        "L2gradient": true,
        "component_connectivity": 8,
        "component_min_pixels": 12,
        "component_min_long_span": 12,
        "clahe": false,
        "morphology": false,
        "dilation": false,
        "thinning": false
      }
    }
  },
  "upscale": {
    "model": "src/models/flashvsr_v1_1",
    "runtime": "src/flashvsr/architect/FlashVSR_v1.1/upscale.py",
    "scale": 4,
    "input_resolution": [
      3840,
      2160
    ],
    "output_resolution": [
      15360,
      8640
    ],
    "fps": 16,
    "tile_size": "auto",
    "tile_overlap": "auto",
    "min_tile_size": 128,
    "sparse_ratio": 2.0,
    "local_range": 11,
    "gpu_index": 0,
    "ffmpeg_threads": 32,
    "encoder": "libx265"
  },
  "final": {
    "fps": 16,
    "center_original_8k": true,
    "center_feather_px": 64,
    "filename": "01_Certification_Final_16K_16fps.mp4",
    "audio_source": "original_8k"
  },
  "verification": {
    "full_decode": false
  },
  "artifacts": {
    "preprocess": "data/01_PreProc_2K_1920x1080/01_PreProc_2K.mp4",
    "preprocess_metadata": "data/01_PreProc_2K_1920x1080/metadata/01",
    "outpaint": "data/02_Outpaint_4K_3840x2160/01",
    "upscale": "data/03_Upscale_16K_15360x8640/01"
  }
}
